{
  "$schema": "../schemas/service-receipt.schema.json",
  "schema_version": "somavera.service-receipt.v1",
  "receipt_id": "4444444444444444444444444444444444444444444444444444444444444444",
  "network_lineage_id": "somavera:network:v1:bbbbbbbbbbbbbbbbbbbbbbbbbbbbbbbbbbbbbbbbbbbbbbbbbbbbbbbbbbbbbbbb",
  "request_id": "5555555555555555555555555555555555555555555555555555555555555555",
  "provider_did": "did:key:example-agent",
  "consumer_did": "did:key:example-consumer",
  "capability": "code.review",
  "started_at": "2027-01-01T00:55:00Z",
  "finished_at": "2027-01-01T01:00:00Z",
  "input_commitment": "6666666666666666666666666666666666666666666666666666666666666666",
  "output_commitment": "3333333333333333333333333333333333333333333333333333333333333333",
  "units": [
    {
      "dimension": "verified_task",
      "amount": "1"
    }
  ],
  "outcome": "succeeded",
  "evidence_ids": [
    "1111111111111111111111111111111111111111111111111111111111111111"
  ],
  "signatures": [
    {
      "role": "provider",
      "signer_did": "did:key:example-agent",
      "suite": "Ed25519-v1",
      "key_id": "did:key:example-agent#key-1",
      "value": "AAAAAAAAAAAAAAAAAAAAAAAAAAAAAAAAAAAAAAAAAAAAAAAAAAAAAAAAAAAAAAAAAAAAAAAAAAAAAAAAAAAAAA=="
    },
    {
      "role": "consumer",
      "signer_did": "did:key:example-consumer",
      "suite": "Ed25519-v1",
      "key_id": "did:key:example-consumer#key-1",
      "value": "AAAAAAAAAAAAAAAAAAAAAAAAAAAAAAAAAAAAAAAAAAAAAAAAAAAAAAAAAAAAAAAAAAAAAAAAAAAAAAAAAAAAAA=="
    }
  ]
}

